{
  "schemaId": "https://schemas.repo-template.dev/adoption-shell-v2/artifact-manifest.schema.json",
  "schemaVersion": "2.0.0",
  "schemaDigest": "b805467065d2538dc3bf21d6249eda17dd4a342a27252e12a8dea7d458256b95",
  "contractId": "repo-template/adoption-shell-v2",
  "contractVersion": "2.0.0",
  "digestAlgorithm": "sha256-rfc8785-v1",
  "artifactDigestAlgorithm": "sha256-rfc8785-v1",
  "artifactDigest": "3816f7b8bc7656e053f78ada36c8b247cf6100fc5177f52b80aa041706936aeb",
  "toolchain": {
    "typescript": "7.0.2",
    "nodeCompatibility": ">=24.16.0 <25",
    "packageManager": "pnpm@11.17.0"
  },
  "entrypoint": "index.js",
  "validatorExport": "validateMaterializerInputV2",
  "runtimeDependencyCount": 0,
  "releaseReceiptKind": "repo-template/release-receipt/v1",
  "sources": [
    {
      "path": "packages/adoption-shell/src/canonical-json.ts",
      "kind": "file",
      "mode": "100644",
      "sha256": "cea23fdb72dfe3eac82857204b8edd86d3cac1a8e64d6006335c1e8d2d267b71",
      "bytes": 2701
    },
    {
      "path": "packages/adoption-shell/src/capability-bundles.ts",
      "kind": "file",
      "mode": "100644",
      "sha256": "6eb864d3188034b95e94990c176015babd686aa7ace888edf0dd562006157ffc",
      "bytes": 12788
    },
    {
      "path": "packages/adoption-shell/src/contract.ts",
      "kind": "file",
      "mode": "100644",
      "sha256": "7f051b7065d3e3e7b050ebd0465b10737a3497a33d6dd0d1d4c969bbf909a02c",
      "bytes": 12188
    },
    {
      "path": "packages/adoption-shell/src/delivery-measurement-contract.ts",
      "kind": "file",
      "mode": "100644",
      "sha256": "7134788347485baf25060c678c44cd65859d4b67f97be9dd22e887b495114120",
      "bytes": 4417
    },
    {
      "path": "packages/adoption-shell/src/delivery-measurement-validation.ts",
      "kind": "file",
      "mode": "100644",
      "sha256": "526123604ee551ff174084491fa2aeefb92c7a3f4993df0e013c1aa421abde08",
      "bytes": 2938
    },
    {
      "path": "packages/adoption-shell/src/delivery-measurement.ts",
      "kind": "file",
      "mode": "100644",
      "sha256": "b56b36108da7fef915c62d100bb9a78464cd7e29fcd0fdb3f704eed0580dad77",
      "bytes": 18839
    },
    {
      "path": "packages/adoption-shell/src/digest.ts",
      "kind": "file",
      "mode": "100644",
      "sha256": "9e86bbbf79ad8553e153d49b69be3b48aeab79c752df457c6b05f36d2bdec50c",
      "bytes": 2308
    },
    {
      "path": "packages/adoption-shell/src/index.ts",
      "kind": "file",
      "mode": "100644",
      "sha256": "25b7449ecd00f0d4fd6689ad8f1529724f465ccc80ac2e4a87896890df79e63c",
      "bytes": 9464
    },
    {
      "path": "packages/adoption-shell/src/local-ci-contract-v2.ts",
      "kind": "file",
      "mode": "100644",
      "sha256": "4c41cd5a1b3726a4fe905e7d259b872c39d79b87aa12399da26271fb6ced81cd",
      "bytes": 12270
    },
    {
      "path": "packages/adoption-shell/src/local-ci-contract-v3-overlay.ts",
      "kind": "file",
      "mode": "100644",
      "sha256": "f9cf1b093340cd37fd54186d25f57c84463205b910bd55a3905d1c6ac1dd033d",
      "bytes": 9151
    },
    {
      "path": "packages/adoption-shell/src/local-ci-contract-v3.ts",
      "kind": "file",
      "mode": "100644",
      "sha256": "a5ac66fb2990b2155663a94246ddabe5717c8edfcb5adc9248321be818b0b9ff",
      "bytes": 19954
    },
    {
      "path": "packages/adoption-shell/src/local-ci-outcome-v1.ts",
      "kind": "file",
      "mode": "100644",
      "sha256": "07f87d011d3b44f6243dd7a535b1ee99386c0741f4bfcfb79395f1573b69b760",
      "bytes": 5607
    },
    {
      "path": "packages/adoption-shell/src/local-ci-v3-candidate-receipt.ts",
      "kind": "file",
      "mode": "100644",
      "sha256": "e89231d416c00e75251577e97556d513b4f6dc15b0b7026275d27142575d58e7",
      "bytes": 13628
    },
    {
      "path": "packages/adoption-shell/src/materialize.ts",
      "kind": "file",
      "mode": "100644",
      "sha256": "1df14aca3506aacdc3a6778625982e8a7ddbe929747ac5948c73822791802200",
      "bytes": 4778
    },
    {
      "path": "packages/adoption-shell/src/path-policy.ts",
      "kind": "file",
      "mode": "100644",
      "sha256": "71dd554c42bd83bf6d257c235f61d84740fc783ec4c51175dbafa1bdf815d16b",
      "bytes": 2656
    },
    {
      "path": "packages/adoption-shell/src/plan-record-v1.ts",
      "kind": "file",
      "mode": "100644",
      "sha256": "ef1c2e93bf67e9057243d85074285f6389768d30b4e9a0e766c1426a017047ee",
      "bytes": 16407
    },
    {
      "path": "packages/adoption-shell/src/product-overlay/product-overlay-contract.ts",
      "kind": "file",
      "mode": "100644",
      "sha256": "e291def9308cc304fe7359c7ca53c0492ba2c7608766f6b1e1b9465cc2d3ad8a",
      "bytes": 13637
    },
    {
      "path": "packages/adoption-shell/src/product-overlay/product-overlay-validation.ts",
      "kind": "file",
      "mode": "100644",
      "sha256": "5fb679bea54200170299b59b09de9563f777cc080c43483b2782edc7e0678ab5",
      "bytes": 23657
    },
    {
      "path": "packages/adoption-shell/src/product-overlay/product-overlay-yaml.ts",
      "kind": "file",
      "mode": "100644",
      "sha256": "329a353fdf22ab8f3cf8a35506c6190f38c8774e6d109a7664ee12a495135324",
      "bytes": 6905
    },
    {
      "path": "packages/adoption-shell/src/product-overlay/product-overlay.ts",
      "kind": "file",
      "mode": "100644",
      "sha256": "f4afd5c59021afdcf2872de8ac61e096d19e18cfb992aa9ca7447c915988f4dd",
      "bytes": 7520
    },
    {
      "path": "packages/adoption-shell/src/product-sli-probe-v1.ts",
      "kind": "file",
      "mode": "100644",
      "sha256": "a34523a2f6d2fc4075a9928db6048dcb754178817dbee6a9e5b9a2cf9e095bbb",
      "bytes": 25564
    },
    {
      "path": "packages/adoption-shell/src/release/release-candidate.ts",
      "kind": "file",
      "mode": "100644",
      "sha256": "48d937b182f899e26613dba754791f650433ff6cbdad653129cdcb1c9e27772a",
      "bytes": 11238
    },
    {
      "path": "packages/adoption-shell/src/release/release-closure.ts",
      "kind": "file",
      "mode": "100644",
      "sha256": "d7c1a6a689179dd11fc7a798f981218a225a6283bd748c79f82c1e5fc4cafee8",
      "bytes": 6340
    },
    {
      "path": "packages/adoption-shell/src/release/release-evidence.ts",
      "kind": "file",
      "mode": "100644",
      "sha256": "abfee74f996ce2b96e4b30090e18a134771d6a4e8286d9d901d6bf7170b65ef5",
      "bytes": 4624
    },
    {
      "path": "packages/adoption-shell/src/release/release-receipt.ts",
      "kind": "file",
      "mode": "100644",
      "sha256": "59ee499c0f6f844354795e8046a0cd2fee42288e64f9399b4857c14b95e9021a",
      "bytes": 13275
    },
    {
      "path": "packages/adoption-shell/src/repository-shape.ts",
      "kind": "file",
      "mode": "100644",
      "sha256": "6dca3e04bd65781135283c79b92d12dfff52cbe8d8a55a2fb4f1faa4dc3d5d67",
      "bytes": 11113
    },
    {
      "path": "packages/adoption-shell/src/repository-shape/validators.generated.ts",
      "kind": "file",
      "mode": "100644",
      "sha256": "29702fe868614950d48752a129d931980251acb5213b7e4d8f38c8c9791ef256",
      "bytes": 9212
    },
    {
      "path": "packages/adoption-shell/src/test-harness.ts",
      "kind": "file",
      "mode": "100644",
      "sha256": "60a2d2db5a680c7a600b792371406a2b3ee380686fa51f8f9893684d9c736ed8",
      "bytes": 14902
    },
    {
      "path": "packages/adoption-shell/src/validate-charter.ts",
      "kind": "file",
      "mode": "100644",
      "sha256": "ed7a36ae5000e609453c78f70b76dcecdbc0b8f9b64c43146c9023145ed52e76",
      "bytes": 3110
    },
    {
      "path": "packages/adoption-shell/src/validate-documentation.ts",
      "kind": "file",
      "mode": "100644",
      "sha256": "67564d60dbe2cb602002dc5afd20379e6dc6ce157fef1b97303f6e90554a6031",
      "bytes": 4781
    },
    {
      "path": "packages/adoption-shell/src/validate-manifests.ts",
      "kind": "file",
      "mode": "100644",
      "sha256": "cdab2d3bcda16310930892e2789e037a35c84c46f2a1fcd8199d68923204160b",
      "bytes": 17887
    },
    {
      "path": "packages/adoption-shell/src/validate.ts",
      "kind": "file",
      "mode": "100644",
      "sha256": "ba2fa573be187707fdf19fb9b1ee4aa8861c5eee9e75397e5ef49fffc3b0073a",
      "bytes": 13057
    },
    {
      "path": "packages/adoption-shell/src/validation-helpers.ts",
      "kind": "file",
      "mode": "100644",
      "sha256": "fb058211c14f39fba07e11908b3679d5e63b9ea805f1fa1d54c410f386801178",
      "bytes": 4537
    },
    {
      "path": "packages/adoption-shell/src/work-migration-manifest-v1.ts",
      "kind": "file",
      "mode": "100644",
      "sha256": "f640801e21c838021c82e02ec2d89209a2d26e2b8067c471b466a754b59dac83",
      "bytes": 14189
    }
  ],
  "schemas": [
    {
      "path": "contracts/adoption-shell-v2/artifact-manifest.schema.json",
      "kind": "file",
      "mode": "100644",
      "sha256": "b805467065d2538dc3bf21d6249eda17dd4a342a27252e12a8dea7d458256b95",
      "bytes": 4163,
      "id": "https://schemas.repo-template.dev/adoption-shell-v2/artifact-manifest.schema.json",
      "version": "2.0.0"
    },
    {
      "path": "contracts/adoption-shell-v2/capability-bundle.schema.json",
      "kind": "file",
      "mode": "100644",
      "sha256": "956cbe96172c5067e2e67327e63c0ea88542983991c595ad489e5413c6a42dd0",
      "bytes": 4027,
      "id": "https://schemas.repo-template.dev/adoption-shell-v2/capability-bundle.schema.json",
      "version": "2.0.0"
    },
    {
      "path": "contracts/adoption-shell-v2/delivery-declaration.schema.json",
      "kind": "file",
      "mode": "100644",
      "sha256": "7d70655d8232962d9a6e95b3edaf256a9d2c0e674ade9877cb787a29b98c5b7e",
      "bytes": 6974,
      "id": "https://schemas.repo-template.dev/delivery-measurement-v1/delivery-declaration.schema.json",
      "version": "2.0.0"
    },
    {
      "path": "contracts/adoption-shell-v2/delivery-event.schema.json",
      "kind": "file",
      "mode": "100644",